category,title,published,author and source,content,excerpt,read more text,read more link
Article,Easter Seals Announces Pioneering Autism Effort,"April 28, 2006","By Peter Gorner, Chicago Tribune","With the stated dream of someday curing autism--a disease being diagnosed in rapidly increasing numbers--Easter Seals Metropolitan Chicago on Thursday announced plans to build a $24 million school and research center on 3.4 acres of land donated by the city.<br><br>Organizers say the 86,000-square-foot facility at Damen Avenue and 13th Street will be the first of its kind in the U.S. to integrate education, academic research, early intervention programs and training to prepare patients for work and independent living.<br><br>Officials see the Therapeutic School and Center for Autism Research as a way to foster interaction between scientists who work on autism and service providers who can apply their findings to clinical practice and education. The facility will be run in collaboration with researchers at the College of Medicine at the University of Illinois at Chicago and Rush University Medical Center.<br><br>""No one has attempted to do something of this scale before. But it's timely, it's needed, and it's altogether unique,"" said Stephen W. Porges, director of the Brain-Body Center at UIC and a leading researcher into the causes and treatment of autism.<br><br>Autism is an incurable, lifelong developmental disability affecting social interactions. Children and adults with the disease find it<br>difficult or impossible to relate to other people in a meaningful way. They may show repetitive patterns of behavior or body movements and often have some degree of mental retardation.<br><br>The disease has been said to affect an estimated 1.5 million Americans, and diagnoses are increasing at a rate of 10 percent to 17 percent a year, though the numbers are a source of controversy. Autism occurs in one in every 166 births and is four times more common in boys than in girls.<br><br>The exact cause of the condition remains a mystery, and there is no cure. Many scientists think autism results from a complex interaction between genetic predisposition and environmental factors.<br><br>Officials outlined their plans at Easter Seals' Therapeutic Day School, 1950 W. Roosevelt Rd., one of two Chicago-area schools where Easter Seals currently provides educational and therapeutic services to more than 150 children with autism. The other is in Tinley Park.<br><br>They hope to break ground on the project in the fall and said $5 million has been raised so far, including a $4 million state grant secured by Illinois House Speaker Michael Madigan. The Chicago City Council has approved donation of the land, valued at $3.5 million.<br><br>Nowhere else in the country will comprehensive services for children with autism be so well integrated at a single campus facility, according to Easter Seals officials.<br><br>""It's being designed from the perspective of the child and not placing the child in a facility that's designed for something else,"" Porges said. ""Their sensitivities to noise, light and the basic environment are not the same. This school takes that into account.""<br><br>In the new facility, researchers will be able to observe and evaluate individuals with autism in environments where they learn and socialize.<br><br>The school will include independent living residence facilities for adults with disabilities, including but not limited to those with autism. The residence will be filled on a first-come, first-served basis.<br><br>Other researchers said they were surprised and excited by the Easter Seals project.<br><br>""I think the need for it is extreme and has been present for some time,"" said Dr. Barbara Trommer, director of the Center for Neurodevelopmental Disabilities at Evanston-Northwestern Health Care. ""The fact that the need is being recognized and addressed in such a comprehensive fashion is a major step forward for the affected children and their families in Chicago.""<br><br>As part of a fundraising campaign launched Thursday, Nuccio Dargento and Rocco DeFrenza, owners of Vince's Italian Restaurant, 4747 N. Harlem Ave. in Harwood Heights, announced a pledge of $100,000.<br><br>Dargento's son, Enzo, has autism. When he started showing signs at age 2 1/2, his father plunged deeply into denial.<br><br>""He started acting like there was nobody there. No speech. No relating. Nothing,"" Dargento said. ""I went through therapy myself because I felt like I'd lost a child. I didn't know what it was. I didn't understand it.""<br><br>Now 7, Enzo attends a program for autistic children in Schaumburg School District 54. He has good days and bad days, but his parents feel like they're getting their child back.<br><br>""He refers to me as Papa, rather than Daddy,"" Dargento said. ""That's an Italian thing. I always called my dad Papa, so I wanted my son to call me Papa.""<br><br>The explosion in autism diagnoses is surrounded by tremendous confusion.<br><br>The number of diagnosed cases in Illinois schoolchildren rose to more than 6,000 in 2003 from 322 in 1992, according to statistics compiled by the U.S. Department of Education. During the same time period, national special education statistics show a 657 percent increase.<br><br>Those statistics are routinely used to suggest the U.S. is experiencing an epidemic of autism.<br><br>However, a new study by University of Wisconsin researcher Paul Shattuck, published in the journal Pediatrics, found that special education data are ""hopelessly confounded by changing and uneven identification reporting practices among schools and states.""<br><br>Many researchers have concluded that greater awareness, improved diagnosis and increased availability of special education services all have affected the autism numbers.","With the stated dream of someday curing autism--a disease being diagnosed in rapidly increasing numbers--Easter Seals Metropolitan Chicago on Thursday announced plans to build a $24 million school and research center on 3.4 acres of land donated by the city.<br><br>Organizers say the 86,000-square-foot facility at Damen Avenue and 13th Street will be the first of its kind in the U.S. to integrate education, academic research, early intervention programs and training to prepare patients for work and independent living.<br><br>Officials see the Therapeutic School and Center for Autism Research as a way to foster interaction between scientists who work on autism and service providers who can apply their findings to clinical practice and education. The facility will be run in collaboration with researchers at the College of Medicine at the University of Illinois at Chicago and Rush University Medical Center.<br><br>""No one has attempted to do something of this scale before. But it's timely, it's needed, and it's altogether unique,"" said Stephen W. Porges, director of the Brain-Body Center at UIC and a leading researcher into the causes and treatment of autism.<br><br>Autism is an incurable, lifelong developmental disability affecting social interactions. Children and adults with the disease find it<br>difficult or impossible to relate to other people in a meaningful way. They may show repetitive patterns of behavior or body movements and often have some degree of mental retardation.<br><br>The disease has been said to affect an estimated 1.5 million Americans, and diagnoses are increasing at a rate of 10 percent to 17 percent a year, though the numbers are a source of controversy. Autism occurs in one in every 166 births and is four times more common in boys than in girls.<br><br>The exact cause of the condition remains a mystery, and there is no cure. Many scientists think autism results from a complex interaction between genetic predisposition and environmental factors.<br><br>Officials outlined their plans at Easter Seals' Therapeutic Day School, 1950 W. Roosevelt Rd., one of two Chicago-area schools where Easter Seals currently provides educational and therapeutic services to more than 150 children with autism. The other is in Tinley Park.<br><br>They hope to break ground on the project in the fall and said $5 million has been raised so far, including a $4 million state grant secured by Illinois House Speaker Michael Madigan. The Chicago City Council has approved donation of the land, valued at $3.5 million.<br><br>Nowhere else in the country will comprehensive services for children with autism be so well integrated at a single campus facility, according to Easter Seals officials.<br><br>""It's being designed from the perspective of the child and not placing the child in a facility that's designed for something else,"" Porges said. ""Their sensitivities to noise, light and the basic environment are not the same. This school takes that into account.""<br><br>In the new facility, researchers will be able to observe and evaluate individuals with autism in environments where they learn and socialize.<br><br>The school will include independent living residence facilities for adults with disabilities, including but not limited to those with autism. The residence will be filled on a first-come, first-served basis.<br><br>Other researchers said they were surprised and excited by the Easter Seals project.<br><br>""I think the need for it is extreme and has been present for some time,"" said Dr. Barbara Trommer, director of the Center for Neurodevelopmental Disabilities at Evanston-Northwestern Health Care. ""The fact that the need is being recognized and addressed in such a comprehensive fashion is a major step forward for the affected children and their families in Chicago.""<br><br>As part of a fundraising campaign launched Thursday, Nuccio Dargento and Rocco DeFrenza, owners of Vince's Italian Restaurant, 4747 N. Harlem Ave. in Harwood Heights, announced a pledge of $100,000.<br><br>Dargento's son, Enzo, has autism. When he started showing signs at age 2 1/2, his father plunged deeply into denial.<br><br>""He started acting like there was nobody there. No speech. No relating. Nothing,"" Dargento said. ""I went through therapy myself because I felt like I'd lost a child. I didn't know what it was. I didn't understand it.""<br><br>Now 7, Enzo attends a program for autistic children in Schaumburg School District 54. He has good days and bad days, but his parents feel like they're getting their child back.<br><br>""He refers to me as Papa, rather than Daddy,"" Dargento said. ""That's an Italian thing. I always called my dad Papa, so I wanted my son to call me Papa.""<br><br>The explosion in autism diagnoses is surrounded by tremendous confusion.<br><br>The number of diagnosed cases in Illinois schoolchildren rose to more than 6,000 in 2003 from 322 in 1992, according to statistics compiled by the U.S. Department of Education. During the same time period, national special education statistics show a 657 percent increase.<br><br>Those statistics are routinely used to suggest the U.S. is experiencing an epidemic of autism.<br><br>However, a new study by University of Wisconsin researcher Paul Shattuck, published in the journal Pediatrics, found that special education data are ""hopelessly confounded by changing and uneven identification reporting practices among schools and states.""<br><br>Many researchers have concluded that greater awareness, improved diagnosis and increased availability of special education services all have affected the autism numbers.",,
Article,How a TIF Transformed a Neighborhood,"April 1, 2006","By Mike Sheridan, Urban Land Magazine","How does one jump-start development in a transitional neighborhood where about 70 percent of the housing stock is rental and where there is not a lot of land available for redevelopment?<br><br>By using tax increment financing (TIF), among other strategies, says Mike Haney, president of Newcastle Limited, a national commercial real estate advisory firm specializing in providing nonprofit organizations with real estate advisory, development, and investment services.<br><br>Loyola University turned to Chicago-based Newcastle Limited to create a strategy for obtaining public financial support for redevelopment and to promote economic development and enhance the student experience in the adjacent neighborhood of Rogers Park, home to Loyola’s 50-acre lakefront campus.<br><br>“The result is an economic development tool that will make Loyola University’s campus and surrounding area more vibrant and attractive to students, faculty, and neighbors,” says Haney.<br><br>Over the past 20 years, the diverse Rogers Park neighborhood has undergone demographic and economic changes resulting in a lack of private investment, inadequate utilities, deteriorated infrastructure, and reduced property values. Rogers Park lacked larger land parcels for development and, according to the 2000 U.S. Census, the median family income was about $34,728.<br><br>Newcastle worked with Loyola to master plan 5.4 acres of underused land adjacent to the campus, oversaw the creation of a 70-acre TIF district, established a framework for garnering community support, and led negotiations with the city of Chicago for economic incentives to help fund the plan. The firm also conducted a sealed-bid offering of a 32,000-square-foot development site, the first of five phases for the planned redevelopment.<br><br>Newcastle also helped Loyola use real estate to recapitalize the university by identifying surplus properties that did not add to its core mission. But instead of selling these properties, Newcastle recommended leasing them to enhance the student experience and improve the community while allowing Loyola to retain control of the property for future use.<br><br>Newcastle negotiated a redevelopment agreement with the city granting Loyola $46 million toward the $85 million preservation of a national historic landmark, infrastructure, and streetscape improvements throughout the community.<br><br>“We believe that a TIF was the right tool to use to jump-start mixed-use development of property adjacent to Loyola’s campus, and to look comprehensively at important gateways to the campus and the city of Chicago,” says Wayne Magdziarz, Loyola University’s vice president of capital planning.<br><br>The result is Loyola Station, a new transportation- and university-oriented development in Rogers Park. The mixed-use project represents the first of five phases in the 5.4-acre, $400 million redevelopment on university-owned land surrounding the Chicago Transit Authority’s Loyola Station “L” stop. As the master developer, the university established economic development and urban planning objectives to guide future development. Phase I of the planned 400,000-square-foot mixed-use development is scheduled for completion in 2008.<br><br>Some of the people involved in this project claim it will play a critical role in the transformation of the area by bringing new vitality in the form of retail and residential development; lead to streetscape improvements; and help renovate the historical landmark.<br><br>“Loyola Station will be one of the largest comprehensive developments undertaken on the north side of Chicago in the past 20 years,” says Haney.—M.S.","How does one jump-start development in a transitional neighborhood where about 70 percent of the housing stock is rental and where there is not a lot of land available for redevelopment?<br><br>By using tax increment financing (TIF), among other strategies, says Mike Haney, president of Newcastle Limited, a national commercial real estate advisory firm specializing in providing nonprofit organizations with real estate advisory, development, and investment services.<br><br>Loyola University turned to Chicago-based Newcastle Limited to create a strategy for obtaining public financial support for redevelopment and to promote economic development and enhance the student experience in the adjacent neighborhood of Rogers Park, home to Loyola’s 50-acre lakefront campus.<br><br>“The result is an economic development tool that will make Loyola University’s campus and surrounding area more vibrant and attractive to students, faculty, and neighbors,” says Haney.<br><br>Over the past 20 years, the diverse Rogers Park neighborhood has undergone demographic and economic changes resulting in a lack of private investment, inadequate utilities, deteriorated infrastructure, and reduced property values. Rogers Park lacked larger land parcels for development and, according to the 2000 U.S. Census, the median family income was about $34,728.<br><br>Newcastle worked with Loyola to master plan 5.4 acres of underused land adjacent to the campus, oversaw the creation of a 70-acre TIF district, established a framework for garnering community support, and led negotiations with the city of Chicago for economic incentives to help fund the plan. The firm also conducted a sealed-bid offering of a 32,000-square-foot development site, the first of five phases for the planned redevelopment.<br><br>Newcastle also helped Loyola use real estate to recapitalize the university by identifying surplus properties that did not add to its core mission. But instead of selling these properties, Newcastle recommended leasing them to enhance the student experience and improve the community while allowing Loyola to retain control of the property for future use.<br><br>Newcastle negotiated a redevelopment agreement with the city granting Loyola $46 million toward the $85 million preservation of a national historic landmark, infrastructure, and streetscape improvements throughout the community.<br><br>“We believe that a TIF was the right tool to use to jump-start mixed-use development of property adjacent to Loyola’s campus, and to look comprehensively at important gateways to the campus and the city of Chicago,” says Wayne Magdziarz, Loyola University’s vice president of capital planning.<br><br>The result is Loyola Station, a new transportation- and university-oriented development in Rogers Park. The mixed-use project represents the first of five phases in the 5.4-acre, $400 million redevelopment on university-owned land surrounding the Chicago Transit Authority’s Loyola Station “L” stop. As the master developer, the university established economic development and urban planning objectives to guide future development. Phase I of the planned 400,000-square-foot mixed-use development is scheduled for completion in 2008.<br><br>Some of the people involved in this project claim it will play a critical role in the transformation of the area by bringing new vitality in the form of retail and residential development; lead to streetscape improvements; and help renovate the historical landmark.<br><br>“Loyola Station will be one of the largest comprehensive developments undertaken on the north side of Chicago in the past 20 years,” says Haney.—M.S.",,
Article,DePaul University Sells 24-Acre Lake Forest Property,"February 1, 2006","By Cis Cuthbertson, Northern Illinois Real Estate Magazine","Newcastle Limited represented DePaul University in the sale of its 24–acre Barat College property in Lake Forest to Barat Woods LLC. Newcastle marketed the property through a sealed–bid offering, evaluated offers based on economics and proposed development plans and negotiated a sale of the property. DePaul, the largest Catholic university in the United States, purchased the 100–year old campus and created an education alliance with Barat College in 2001, but enrollments fell short and DePaul closed the campus in June of 2005. The former college campus consists of natural ravines, a cemetery, and nine buildings. One of the original buildings, Old Main, located in the heart of campus, is a Lake Forest historic landmark. “We were able to exceed the goals of DePaul University in this complex transaction. It was a win–win transaction for all parties involved,” said S.L. van der Zanden, managing principal of Newcastle Limited.","Newcastle Limited represented DePaul University in the sale of its 24–acre Barat College property in Lake Forest to Barat Woods LLC. Newcastle marketed the property through a sealed–bid offering, evaluated offers based on economics and proposed development plans and negotiated a sale of the property. DePaul, the largest Catholic university in the United States, purchased the 100–year old campus and created an education alliance with Barat College in 2001, but enrollments fell short and DePaul closed the campus in June of 2005. The former college campus consists of natural ravines, a cemetery, and nine buildings. One of the original buildings, Old Main, located in the heart of campus, is a Lake Forest historic landmark. “We were able to exceed the goals of DePaul University in this complex transaction. It was a win–win transaction for all parties involved,” said S.L. van der Zanden, managing principal of Newcastle Limited.",,
Article,DePaul selling former Barat College site to developer,"January 26, 2006","By David Roeder, Chicago Sun-Times","DePaul University said Wednesday it is selling the former Barat College in Lake Forest to local housing builder Robert Shaw.<br><br>Terms for the 23–acre site, 700 E. Westleigh Rd., were not disclosed. Barat, which DePaul closed in June, poses a rare opportunity for large–scale development in a built–up section of the wealthy North Shore community.<br><br>Plans haven’t been finalized, but officials said it will preserve some features of the campus, including the original college building called Old Main, now slated for condominiums. The broad south lawn, the location of Barat’s “Shakespeare on the Green” festivals, will be preserved, Shaw and DePaul said.<br><br>DePaul bought the liberal arts school in 2001.<br><br>Shaw is a Lake Forest resident who has built subdivisions in the community and developed homes in Colorado and North Carolina. He ran the speaker manufacturer International Jensen Inc. for 12 years until 1996.<br><br>Joining him as a partner in the acquisition is the Barat Education Foundation, which had the right to pre–empt any sale to a private developer. The foundation administers Barat’s endowment and runs programs for alumni.<br><br>Newcastle Ltd. represented DePaul in the negotiations. S.L. van der Zanden, managing principal of Newcastle, said the property is zoned for single–family estate homes.<br><br>In a statement issued by DePaul, Lake Forest Mayor S. Michael Rummel praised the deal. He said he expects Shaw’s plan “will be sensitive to the issues that are important to our community, including historic preservation, open space, traffic volumes and high quality development.”","DePaul University said Wednesday it is selling the former Barat College in Lake Forest to local housing builder Robert Shaw.<br><br>Terms for the 23–acre site, 700 E. Westleigh Rd., were not disclosed. Barat, which DePaul closed in June, poses a rare opportunity for large–scale development in a built–up section of the wealthy North Shore community.<br><br>Plans haven’t been finalized, but officials said it will preserve some features of the campus, including the original college building called Old Main, now slated for condominiums. The broad south lawn, the location of Barat’s “Shakespeare on the Green” festivals, will be preserved, Shaw and DePaul said.<br><br>DePaul bought the liberal arts school in 2001.<br><br>Shaw is a Lake Forest resident who has built subdivisions in the community and developed homes in Colorado and North Carolina. He ran the speaker manufacturer International Jensen Inc. for 12 years until 1996.<br><br>Joining him as a partner in the acquisition is the Barat Education Foundation, which had the right to pre–empt any sale to a private developer. The foundation administers Barat’s endowment and runs programs for alumni.<br><br>Newcastle Ltd. represented DePaul in the negotiations. S.L. van der Zanden, managing principal of Newcastle, said the property is zoned for single–family estate homes.<br><br>In a statement issued by DePaul, Lake Forest Mayor S. Michael Rummel praised the deal. He said he expects Shaw’s plan “will be sensitive to the issues that are important to our community, including historic preservation, open space, traffic volumes and high quality development.”",,
