category,title,published,author and source,content,excerpt,read more text,read more link
Press Release,Newcastle Limited buys Multi-Family Investment Property in Chicago's Lakeview Neighborhood,"June 13, 2011",,"CHICAGO – Newcastle Limited has acquired 426 West Belmont, a 13-story, 98-unit apartment building in Lakeview. The $10.55 million, all-cash purchase was made on behalf of the firm’s $500 million Chicago real estate investment platform.  Bill Baumann of the Kiser Group represented the seller in the transaction. The property is located in the densely populated and affluent Lakeview neighborhood, and offers a mix of studio and one-bedroom apartments. Proximity to public transportation, Belmont Harbor and the lakefront, as well as to nearby retail, restaurants and nightlife, make it attractive to area renters. “Our acquisition of this asset helped the former lender liquidate its position, and was another great addition to our growing portfolio” said Michael R. Haney, president and CEO of Newcastle Limited.  “Our all-cash offer provided certainty of execution and a quick close ⎯ important considerations for lenders forced to foreclose on properties.  The property has a great location and offers an opportunity to upgrade the look and amenities of the building to appeal to today’s renter.” Newcastle Limited is a Chicago-based real estate advisory and investment firm serving institutions, corporations and investors.  The firm helps clients use real estate strategically to achieve overall mission objectives more quickly, at a lower cost, and with less risk.  Using its $500 million investment platform, Newcastle acquires urban Chicago real estate, including multi-family, retail, mixed-use and other commercial assets.  An entrepreneurial investor with institutional backing, Newcastle can deploy large amounts of capital and close transactions quickly.   To learn more about Newcastle, call Mike Haney at (312) 252-1401 or visit the company website at www.newcastlelimited.com.","CHICAGO – Newcastle Limited has acquired 426 West Belmont, a 13-story, 98-unit apartment building in Lakeview. The $10.55 million, all-cash purchase was made on behalf of the firm’s $500 million Chicago real estate investment platform.  Bill Baumann of the Kiser Group represented the seller in the transaction. The property is located in the densely populated and affluent Lakeview neighborhood, and offers a mix of studio and one-bedroom apartments. Proximity to public transportation, Belmont Harbor and the lakefront, as well as to nearby retail, restaurants and nightlife, make it attractive to area renters. “Our acquisition of this asset helped the former lender liquidate its position, and was another great addition to our growing portfolio” said Michael R. Haney, president and CEO of Newcastle Limited.  “Our all-cash offer provided certainty of execution and a quick close ⎯ important considerations for lenders forced to foreclose on properties.  The property has a great location and offers an opportunity to upgrade the look and amenities of the building to appeal to today’s renter.” Newcastle Limited is a Chicago-based real estate advisory and investment firm serving institutions, corporations and investors.  The firm helps clients use real estate strategically to achieve overall mission objectives more quickly, at a lower cost, and with less risk.  Using its $500 million investment platform, Newcastle acquires urban Chicago real estate, including multi-family, retail, mixed-use and other commercial assets.  An entrepreneurial investor with institutional backing, Newcastle can deploy large amounts of capital and close transactions quickly.   To learn more about Newcastle, call Mike Haney at (312) 252-1401 or visit the company website at www.newcastlelimited.com.",,
Press Release,Newcastle Limited buys Retail Investment Property in Chicago's Loop,"June 10, 2011",,"CHICAGO – Newcastle Limited has acquired a 7,300-square-foot retail property located at 33 South Wabash in Chicago’s Loop in an all-cash deal for $4.0 million. Newcastle purchased the property on behalf of the firm’s $500 million Chicago real estate investment platform. The property is located at the base of The Legacy at Millennium Park, a 355-unit, high-end condominium building, and is one block west of Michigan Avenue and Millennium Park.  The east portion of Chicago’s Loop has, in recent years, become a vibrant, mixed-use neighborhood of office, retail and residential uses — and home to a number of educational institutions with more than 65,000 students. The retail space is currently 100% occupied by Utrecht Art Supplies, a leading provider of art supplies and a retail destination for area students. Newcastle purchased the property directly from the owner, Monroe/Wabash Retail, LLC, which is a partnership of Mesa Development, LLC and Walsh Investors, LLC.  “We were attracted to the property because of its Loop location and Utrecht’s long-term relationship with The School of the Art Institute, a long-time Newcastle client and adjacent property owner,” said Michael R. Haney, president and CEO of Newcastle Limited. Newcastle represented the School of the Art Institute in the sale of land to Mesa for The Legacy project in 2005. Newcastle Limited is a Chicago-based real estate advisory and investment firm serving institutions, corporations and investors.  The firm helps clients use real estate strategically to achieve overall mission objectives more quickly, at a lower cost, and with less risk.  Using its $500 million investment platform, Newcastle acquires urban Chicago real estate, including multi-family, retail, mixed-use and other commercial assets.  An entrepreneurial investor with institutional backing, Newcastle can deploy large amounts of capital and close transactions quickly.   To learn more about Newcastle, call Mike Haney at (312) 252-1401 or visit the company website at www.newcastlelimited.com.   ","CHICAGO – Newcastle Limited has acquired a 7,300-square-foot retail property located at 33 South Wabash in Chicago’s Loop in an all-cash deal for $4.0 million. Newcastle purchased the property on behalf of the firm’s $500 million Chicago real estate investment platform. The property is located at the base of The Legacy at Millennium Park, a 355-unit, high-end condominium building, and is one block west of Michigan Avenue and Millennium Park.  The east portion of Chicago’s Loop has, in recent years, become a vibrant, mixed-use neighborhood of office, retail and residential uses — and home to a number of educational institutions with more than 65,000 students. The retail space is currently 100% occupied by Utrecht Art Supplies, a leading provider of art supplies and a retail destination for area students. Newcastle purchased the property directly from the owner, Monroe/Wabash Retail, LLC, which is a partnership of Mesa Development, LLC and Walsh Investors, LLC.  “We were attracted to the property because of its Loop location and Utrecht’s long-term relationship with The School of the Art Institute, a long-time Newcastle client and adjacent property owner,” said Michael R. Haney, president and CEO of Newcastle Limited. Newcastle represented the School of the Art Institute in the sale of land to Mesa for The Legacy project in 2005. Newcastle Limited is a Chicago-based real estate advisory and investment firm serving institutions, corporations and investors.  The firm helps clients use real estate strategically to achieve overall mission objectives more quickly, at a lower cost, and with less risk.  Using its $500 million investment platform, Newcastle acquires urban Chicago real estate, including multi-family, retail, mixed-use and other commercial assets.  An entrepreneurial investor with institutional backing, Newcastle can deploy large amounts of capital and close transactions quickly.   To learn more about Newcastle, call Mike Haney at (312) 252-1401 or visit the company website at www.newcastlelimited.com.   ",,
Press Release,Newcastle Limited buys Investment Property in Chicago's Lincoln Park Neighborhood,"April 19, 2011",,"CHICAGO – Newcastle Limited has acquired 2727 North Pine Grove, a 48-unit apartment building with parking in the Lincoln Park neighborhood, for $5.9 million.  Newcastle purchased the property on behalf of the firm’s $500 million Chicago real estate investment platform.  The all-cash deal closed in 60 days.  Jack Cassin and Bill Cassin of Apartment Investment Advisers represented Newcastle in the transaction.<br>The property is located on a quiet residential street in Lincoln Park and offers a mix of studio and one-bedroom units.  Its proximity to public transportation, Lincoln Park and the lakefront, and to an abundance of retail, restaurants and nightlife makes it very attractive to area renters.<br>“The property’s sought-after location made it an excellent investment opportunity and a great addition to our growing portfolio” said Michael R. Haney, president and CEO of Newcastle Limited. “Our ability to close this acquisition quickly on an all-cash basis was a compelling factor for the seller.”<br>Newcastle’s plans for the property include upgrading the units and common areas, and improving the curb appeal over the next 24 months.<br>Newcastle Limited is a Chicago-based real estate advisory and investment firm serving institutions, corporations and investors.  The firm helps clients use real estate strategically to achieve overall mission objectives more quickly, at a lower cost, and with less risk.  Using its $500 million investment platform, Newcastle acquires urban Chicago real estate, including multi-family, retail, mixed-use and other commercial assets.  An entrepreneurial investor with institutional backing, Newcastle can deploy large amounts of capital and close transactions quickly.   To learn more about Newcastle, call Mike Haney at (312) 252-1401 or visit the company website at www.newcastlelimited.com.","CHICAGO – Newcastle Limited has acquired 2727 North Pine Grove, a 48-unit apartment building with parking in the Lincoln Park neighborhood, for $5.9 million.  Newcastle purchased the property on behalf of the firm’s $500 million Chicago real estate investment platform.  The all-cash deal closed in 60 days.  Jack Cassin and Bill Cassin of Apartment Investment Advisers represented Newcastle in the transaction.<br>The property is located on a quiet residential street in Lincoln Park and offers a mix of studio and one-bedroom units.  Its proximity to public transportation, Lincoln Park and the lakefront, and to an abundance of retail, restaurants and nightlife makes it very attractive to area renters.<br>“The property’s sought-after location made it an excellent investment opportunity and a great addition to our growing portfolio” said Michael R. Haney, president and CEO of Newcastle Limited. “Our ability to close this acquisition quickly on an all-cash basis was a compelling factor for the seller.”<br>Newcastle’s plans for the property include upgrading the units and common areas, and improving the curb appeal over the next 24 months.<br>Newcastle Limited is a Chicago-based real estate advisory and investment firm serving institutions, corporations and investors.  The firm helps clients use real estate strategically to achieve overall mission objectives more quickly, at a lower cost, and with less risk.  Using its $500 million investment platform, Newcastle acquires urban Chicago real estate, including multi-family, retail, mixed-use and other commercial assets.  An entrepreneurial investor with institutional backing, Newcastle can deploy large amounts of capital and close transactions quickly.   To learn more about Newcastle, call Mike Haney at (312) 252-1401 or visit the company website at www.newcastlelimited.com.",,
Press Release,Newcastle Limited buys Retail Property in Chicago's Edgewater Neighborhood,"March 2, 2011",,"CHICAGO – Newcastle Limited has acquired 5343 N. Broadway, a 50,000 square foot retail property on 2.8 acres of land with 160 parking spaces in Chicago’s Edgewater neighborhood, for $8 million.  The all-cash deal closed in 60 days.  Newcastle purchased the property on behalf of the firm’s $500 million Chicago real estate investment platform.  This is the fifth acquisition for Newcastle since December.<br>The retail property is located at the corner of Berwyn and Broadway, a highly traveled thoroughfare with a strong traffic count of 21,000 vehicles per day.  The property is also adjacent to the CTA Red Line’s Berwyn station, which had 1.5 million riders in 2010 and is the main stop for the popular Andersonville neighborhood. The single-story building is occupied by Jewel-Osco.<br> “The property’s location, visibility and tenancy made it an attractive investment opportunity and another great addition to our growing retail portfolio,” said Michael R. Haney, president and CEO of Newcastle Limited.  ”We are pleased to continue to find urban Chicago investment opportunities that fit squarely with our strategy.”<br>Marc Imrem of Baum Realty Group represented the seller.<br>Newcastle Limited is a Chicago-based real estate advisory and investment firm serving institutions, corporations and investors.  The firm helps clients use real estate strategically to achieve overall mission objectives more quickly, at a lower cost, and with less risk.  Using its $500 million investment platform, Newcastle acquires urban Chicago real estate, including multi-family, retail, mixed-use and other commercial assets.  An entrepreneurial investor with institutional backing, Newcastle can deploy large amounts of capital and close transactions quickly.   To learn more about Newcastle, call Mike Haney at (312) 252-1401 or visit the company website at www.newcastlelimited.com.","CHICAGO – Newcastle Limited has acquired 5343 N. Broadway, a 50,000 square foot retail property on 2.8 acres of land with 160 parking spaces in Chicago’s Edgewater neighborhood, for $8 million.  The all-cash deal closed in 60 days.  Newcastle purchased the property on behalf of the firm’s $500 million Chicago real estate investment platform.  This is the fifth acquisition for Newcastle since December.<br>The retail property is located at the corner of Berwyn and Broadway, a highly traveled thoroughfare with a strong traffic count of 21,000 vehicles per day.  The property is also adjacent to the CTA Red Line’s Berwyn station, which had 1.5 million riders in 2010 and is the main stop for the popular Andersonville neighborhood. The single-story building is occupied by Jewel-Osco.<br> “The property’s location, visibility and tenancy made it an attractive investment opportunity and another great addition to our growing retail portfolio,” said Michael R. Haney, president and CEO of Newcastle Limited.  ”We are pleased to continue to find urban Chicago investment opportunities that fit squarely with our strategy.”<br>Marc Imrem of Baum Realty Group represented the seller.<br>Newcastle Limited is a Chicago-based real estate advisory and investment firm serving institutions, corporations and investors.  The firm helps clients use real estate strategically to achieve overall mission objectives more quickly, at a lower cost, and with less risk.  Using its $500 million investment platform, Newcastle acquires urban Chicago real estate, including multi-family, retail, mixed-use and other commercial assets.  An entrepreneurial investor with institutional backing, Newcastle can deploy large amounts of capital and close transactions quickly.   To learn more about Newcastle, call Mike Haney at (312) 252-1401 or visit the company website at www.newcastlelimited.com.",,
Press Release,Newcastle Limited Buys its Fourth Urban Chicago Retail Property since December,"February 22, 2011",,"CHICAGO – Newcastle Limited has acquired 670 West Diversey, a 10,700 square foot retail property located on the border of Chicago’s Lincoln Park and Lakeview neighborhoods, for $6.1 million.  The all-cash deal closed in 50 days.  Newcastle purchased the property on behalf of the firm’s $500 million Chicago real estate investment platform.  Since December, Newcastle has closed on four acquisitions.<br>Located just west of where Clark Street, Diversey Parkway and Broadway Avenue converge, the retail center is positioned in an area with one of the highest pedestrian counts in Chicago, and is on the border of two of the most affluent and densely populated neighborhoods in the city.   The single-story building is 100% occupied by Firkin &amp; Pheasant, an English-style pub; Akira, a popular clothing, footwear and accessory store for men and women; and The Counter, which puts a 21st century twist on the classic burger joint by featuring unique cocktails, wines, beer and music.<br>“The property’s location, visibility and strong demographics made it an attractive investment opportunity,” said Michael R. Haney, president and CEO of Newcastle Limited.  ”This fits squarely in our urban Chicago investment strategy and is a great addition to our growing retail portfolio.”<br>Newcastle purchased the property directly from the owner.<br>Newcastle Limited is a Chicago-based real estate advisory and investment firm serving institutions, corporations and investors.  The firm helps clients use real estate strategically to achieve overall mission objectives more quickly, at a lower cost, and with less risk.  Using its $500 million investment platform, Newcastle acquires urban Chicago real estate, including multi-family, retail, mixed-use and other commercial assets.  An entrepreneurial investor with institutional backing, Newcastle can deploy large amounts of capital and close transactions quickly.   To learn more about Newcastle, call Mike Haney at (312) 252-1401 or visit the company website at www.newcastlelimited.com.","CHICAGO – Newcastle Limited has acquired 670 West Diversey, a 10,700 square foot retail property located on the border of Chicago’s Lincoln Park and Lakeview neighborhoods, for $6.1 million.  The all-cash deal closed in 50 days.  Newcastle purchased the property on behalf of the firm’s $500 million Chicago real estate investment platform.  Since December, Newcastle has closed on four acquisitions.<br>Located just west of where Clark Street, Diversey Parkway and Broadway Avenue converge, the retail center is positioned in an area with one of the highest pedestrian counts in Chicago, and is on the border of two of the most affluent and densely populated neighborhoods in the city.   The single-story building is 100% occupied by Firkin &amp; Pheasant, an English-style pub; Akira, a popular clothing, footwear and accessory store for men and women; and The Counter, which puts a 21st century twist on the classic burger joint by featuring unique cocktails, wines, beer and music.<br>“The property’s location, visibility and strong demographics made it an attractive investment opportunity,” said Michael R. Haney, president and CEO of Newcastle Limited.  ”This fits squarely in our urban Chicago investment strategy and is a great addition to our growing retail portfolio.”<br>Newcastle purchased the property directly from the owner.<br>Newcastle Limited is a Chicago-based real estate advisory and investment firm serving institutions, corporations and investors.  The firm helps clients use real estate strategically to achieve overall mission objectives more quickly, at a lower cost, and with less risk.  Using its $500 million investment platform, Newcastle acquires urban Chicago real estate, including multi-family, retail, mixed-use and other commercial assets.  An entrepreneurial investor with institutional backing, Newcastle can deploy large amounts of capital and close transactions quickly.   To learn more about Newcastle, call Mike Haney at (312) 252-1401 or visit the company website at www.newcastlelimited.com.",,
Press Release,Newcastle Limited Buys Retail Property in Chicago's Streeterville Neighborhood,"February 1, 2011",,"CHICAGO, IL - Newcastle Limited has acquired 227 East Ontario, a 15,500 square foot commercial property with parking in Chicago's Streeterville neighborhood, for $5.9 million. The all-cash deal closed in less than 40 days and is Newcastle's third acquisition in the past 60 days. The transaction required the assemblage of land under the building from two separate ownership entities. Newcastle purchased the property on behalf of the firm's $500 million Chicago real estate investment platform. <br>Located two blocks east of Michigan Avenue on Ontario, the property is located in one of Chicago's most established, high-density neighborhoods. The two-story building was recently occupied by the U.S. Post Service, which vacated the building earlier this month. Newcastle plans to add 885 square feet of space to the property and redevelop the building as a well-located, premier retail property.<br>""The property's location in the well-established, targeted retail corridor in Streeterville fits with our investment strategy to increase our urban Chicago retail holdings,"" said Michael R. Haney, president and CEO of Newcastle Limited. ""The property's visibility and impressive area demographics, in addition to our retail plans, has already attracted positive attention from several retailers.""<br>Paul Bryant and David Stensby of Mid America Real Estate represented the sellers in the transaction. Newcastle has retained Mid America to market the property.<br>Newcastle Limited is a Chicago-based real estate advisory and investment firm serving institutions, corporations and investors. The firm helps clients use real estate strategically to achieve overall mission objectives more quickly, at a lower cost, and with less risk. Using its $500 million investment platform, Newcastle acquires urban Chicago real estate -- multi-family, retail and mixed-use. An entrepreneurial investor with institutional backing, Newcastle can deploy large amounts of capital and close transactions quickly. To learn more about Newcastle, call Mike Haney at (312) 252-1401 or visit the company website at www.newcastlelimited.com.","CHICAGO, IL - Newcastle Limited has acquired 227 East Ontario, a 15,500 square foot commercial property with parking in Chicago's Streeterville neighborhood, for $5.9 million. The all-cash deal closed in less than 40 days and is Newcastle's third acquisition in the past 60 days. The transaction required the assemblage of land under the building from two separate ownership entities. Newcastle purchased the property on behalf of the firm's $500 million Chicago real estate investment platform. <br>Located two blocks east of Michigan Avenue on Ontario, the property is located in one of Chicago's most established, high-density neighborhoods. The two-story building was recently occupied by the U.S. Post Service, which vacated the building earlier this month. Newcastle plans to add 885 square feet of space to the property and redevelop the building as a well-located, premier retail property.<br>""The property's location in the well-established, targeted retail corridor in Streeterville fits with our investment strategy to increase our urban Chicago retail holdings,"" said Michael R. Haney, president and CEO of Newcastle Limited. ""The property's visibility and impressive area demographics, in addition to our retail plans, has already attracted positive attention from several retailers.""<br>Paul Bryant and David Stensby of Mid America Real Estate represented the sellers in the transaction. Newcastle has retained Mid America to market the property.<br>Newcastle Limited is a Chicago-based real estate advisory and investment firm serving institutions, corporations and investors. The firm helps clients use real estate strategically to achieve overall mission objectives more quickly, at a lower cost, and with less risk. Using its $500 million investment platform, Newcastle acquires urban Chicago real estate -- multi-family, retail and mixed-use. An entrepreneurial investor with institutional backing, Newcastle can deploy large amounts of capital and close transactions quickly. To learn more about Newcastle, call Mike Haney at (312) 252-1401 or visit the company website at www.newcastlelimited.com.",,
