category,title,published,author and source,content,excerpt,read more text,read more link
Press Release,Newcastle Limited Selected by Archstone-Smith to Conduct a Sealed-Bid Offering for Lakeshore East Development Site,"October 25, 2004",,"CHICAGO – Newcastle Limited has been retained by Denver, Colo.–based Archstone–Smith (NYSE: ASN) to manage the disposition of a 2.4–acre high–rise development site, located in the Lakeshore East neighborhood of downtown Chicago, announced Michael R. Haney, President of the Chicago–based real estate firm. Newcastle Limited is a national real estate advisory and development firm serving not–for–profit organizations, institutions, investors, corporations and governmental agencies.The parcels are located along Columbus Drive, just north of the Blue Cross/Blue Shield Building and one block north of Millennium Park. The 28–acre Lakeshore East neighborhood, a $2.5–billion, mixed–use, master planned development community, designed by Skidmore, Owings and Merrill, LLP, is one of the largest parcels of undeveloped downtown land in a major U.S. city.“This site is exquisitely located between Lake Michigan and the DuSable Marina on the east and Millennium Park and world–class shopping of Michigan Avenue on the west. The land is already zoned and ready for the development of residential apartments or condominiums,” said Martin F. Jablonski, Newcastle Director and Project Manager for the disposition team, which includes Peter S. Tortorello, Vice President, and Gregory Russell, Associate. The deadline for offers is November 22, 2004.Archstone–Smith purchased the site in 2002 from Lakeshore East co–developers, Magellan Development Group, Ltd., and Near North Properties Inc. The greater Chicagoland area is a core market for Archstone–Smith, representing 9 percent of its national portfolio. The company currently owns and operates 10 communities here, representing nearly 5,000 units.About Newcastle LimitedChicago–based Newcastle Limited is a national commercial real estate firm serving governmental agencies, institutions, not–for–profit organizations, corporations and private investors. The firm’s strategic advisory, development and investment services are designed to reduce project risk and maximize asset value. To learn more about Newcastle, call Michael Haney at (312) 252–1401 or visit the company website at www.newcastlelimited.com.About Archstone–Smith Archstone–Smith is a recognized leader in apartment investment and operations. As of August 31, 2004, the company, with a total market capitalization in excess of $11 billion, owned or held an ownership position in 240 properties representing 83,335 units including those under construction.","CHICAGO – Newcastle Limited has been retained by Denver, Colo.–based Archstone–Smith (NYSE: ASN) to manage the disposition of a 2.4–acre high–rise development site, located in the Lakeshore East neighborhood of downtown Chicago, announced Michael R. Haney, President of the Chicago–based real estate firm. Newcastle Limited is a national real estate advisory and development firm serving not–for–profit organizations, institutions, investors, corporations and governmental agencies.The parcels are located along Columbus Drive, just north of the Blue Cross/Blue Shield Building and one block north of Millennium Park. The 28–acre Lakeshore East neighborhood, a $2.5–billion, mixed–use, master planned development community, designed by Skidmore, Owings and Merrill, LLP, is one of the largest parcels of undeveloped downtown land in a major U.S. city.“This site is exquisitely located between Lake Michigan and the DuSable Marina on the east and Millennium Park and world–class shopping of Michigan Avenue on the west. The land is already zoned and ready for the development of residential apartments or condominiums,” said Martin F. Jablonski, Newcastle Director and Project Manager for the disposition team, which includes Peter S. Tortorello, Vice President, and Gregory Russell, Associate. The deadline for offers is November 22, 2004.Archstone–Smith purchased the site in 2002 from Lakeshore East co–developers, Magellan Development Group, Ltd., and Near North Properties Inc. The greater Chicagoland area is a core market for Archstone–Smith, representing 9 percent of its national portfolio. The company currently owns and operates 10 communities here, representing nearly 5,000 units.About Newcastle LimitedChicago–based Newcastle Limited is a national commercial real estate firm serving governmental agencies, institutions, not–for–profit organizations, corporations and private investors. The firm’s strategic advisory, development and investment services are designed to reduce project risk and maximize asset value. To learn more about Newcastle, call Michael Haney at (312) 252–1401 or visit the company website at www.newcastlelimited.com.About Archstone–Smith Archstone–Smith is a recognized leader in apartment investment and operations. As of August 31, 2004, the company, with a total market capitalization in excess of $11 billion, owned or held an ownership position in 240 properties representing 83,335 units including those under construction.",,
Press Release,Newcastle Limited to Conduct Sealed-Bid Offering for Rubens Baby Factory Facility in Chicago's Lincoln Park Neighborhood,"September 19, 2004",,"CHICAGO – Newcastle Limited has been retained by Rubens &amp; Marble, Inc., to manage the disposition of its 82-year-old, 62,100 SF, two-story, commercial building at 2340 North Racine Avenue in the Lincoln Park neighborhood of Chicago, announced Michael R. Haney, President of the Chicago-based real estate firm. Newcastle Limited is a national real estate advisory and development firm serving not-for-profit corporations, institutions, investors, corporations and governmental agencies.<br><br>“This property represents the rare opportunity for hotel, institutional, residential or mixed-use development on a large site in one of Chicago’s most desirable neighborhoods where the demand for high-end condominiums, townhouses and single-family homes is exceptionally strong,” said Martin F. Jablonski, Newcastle Director and Project Manager for the disposition in team with Peter S. Tortorello, Vice President. The deadline for offers is October 29, 2004.<br><br>The building, known as the “Rubens Baby Factory,” is situated on a 32,185 SF parcel with visibility and frontage along North Racine, West Fullerton, and West Medill Avenues. The steel and reinforced-concrete facility, built in 1922, has a solid red brick façade and a poured-concrete foundation. It features 12-foot ceilings, loft-style windows, two interior depressed docks, floor loads of 250 PSF, and the structural capacity to accommodate additional floors.<br><br>The property is located in the burgeoning Lincoln Park neighborhood on the north side, just west of DePaul University and across the street from the Lincoln Park Branch of the Chicago Public Library. “Demographically, the surrounding area is characterized by an educated, highly skilled, white-collar work force with an average household income of $145,443 within a half-mile radius,” he said. According to Tortorello, the property, which is currently zoned M1-2 Restricted Manufacturing District, is adjacent to residential and business zoning districts. The disposition marks the end of a 114-year-old Chicago manufacturing business.<br><br>End of an Era<br><br>The building was designed to accommodate a bank-note printing company, but during the Great Depression, the printer went bankrupt. On November 16, 1936, the building was purchased to house Rubens &amp; Marble, a company that specialized in the manufacture of quality infant’s cotton underwear since its founding in 1890. In 1912, the company was incorporated, and the name has remained the same for 92 years. In fact the same drawing of the building has appeared on the company letterhead for more than 60 years.<br><br>“The peak for our business was during the Baby Boom following World War II. At that time I am told there were 300 employees making baby clothes to meet the demand,” said Richard A. Rubens, President of Rubens &amp; Marble. During the late 1980s and early 1990s, the company averaged approximately 95 employees. Today there are 38 employees, but not for long. Rubens &amp; Marble will close for good by Thanksgiving of this year.<br><br>“We can no longer compete. The imports coming from China are cheaper than I can manufacture them for. The quality? Not bad,” he said. According to Rubens, the primary downside of imports is the limited line. “Whereas we make baby underwear in all oddball sizes and styles, the exporters only make the most popular sizes and styles,” he said.<br><br>Other factors contributing to the demise of Rubens &amp; Marble include his two sons’ decisions not to carry on the textile manufacturing business (but to become a doctor and a lawyer) and competition from volume discounters. “At one time, we sold to the big discount stores, but today we are national institutional suppliers serving hospitals across the country,” he said.<br>According to Rubens, by far the most significant factor leading to the demise of his business is the dramatic increase in the minimum wage. “The State of Illinois raised the minimum wage by $.35 per hour in January of this year. When we raised our prices to absorb the increase, we lost a ton of business. Now the minimum wage is set to increase another dollar per hour from $5.50 to $6.50 per hour on January 1st of 2005. It is the last straw. You can’t make money when your costs keep going up and your volume keeps going down,” he said.<br><br>Over the years the company has become a well-known neighbor in Lincoln Park. “We occasionally sell to the public from two desks piled high with baby clothes,” Rubens said. Along the way, it has even acquired a nickname. “Our building is located just down the street from the Oscar F. Mayer Grade School (2250 North Clifton Avenue). During the early 1970s, a little girl attending the school used to eat her lunch in the lobby of our building to avoid being taunted by the schoolboys. She referred to the building as the Rubens Baby Factory, and it stuck,” he said.<br><br>Rubens admits it is upsetting to leave a building he has been coming to since he was seven years old, but he’s not bitter. “Right now we are extremely busy serving our customers, but I am looking forward to traveling.”<br><br>If you drive by the building today, you will see a sign in the window that says “Rubens Baby Factory Store.” Come Thanksgiving, you may also see another sign: “Gone fishing.<br><br>About Newcastle Limited<br>Chicago-based Newcastle Limited is a national commercial real estate firm serving governmental agencies, institutions, not-for-profit organizations, corporations and private investors. The firm’s strategic advisory, development and investment services are designed to reduce project risk and maximize asset value. To learn more about Newcastle, call Mike Haney at (312) 252-1401 or visit the company website at www.newcastlelimited.com.","CHICAGO – Newcastle Limited has been retained by Rubens &amp; Marble, Inc., to manage the disposition of its 82-year-old, 62,100 SF, two-story, commercial building at 2340 North Racine Avenue in the Lincoln Park neighborhood of Chicago, announced Michael R. Haney, President of the Chicago-based real estate firm. Newcastle Limited is a national real estate advisory and development firm serving not-for-profit corporations, institutions, investors, corporations and governmental agencies.<br><br>“This property represents the rare opportunity for hotel, institutional, residential or mixed-use development on a large site in one of Chicago’s most desirable neighborhoods where the demand for high-end condominiums, townhouses and single-family homes is exceptionally strong,” said Martin F. Jablonski, Newcastle Director and Project Manager for the disposition in team with Peter S. Tortorello, Vice President. The deadline for offers is October 29, 2004.<br><br>The building, known as the “Rubens Baby Factory,” is situated on a 32,185 SF parcel with visibility and frontage along North Racine, West Fullerton, and West Medill Avenues. The steel and reinforced-concrete facility, built in 1922, has a solid red brick façade and a poured-concrete foundation. It features 12-foot ceilings, loft-style windows, two interior depressed docks, floor loads of 250 PSF, and the structural capacity to accommodate additional floors.<br><br>The property is located in the burgeoning Lincoln Park neighborhood on the north side, just west of DePaul University and across the street from the Lincoln Park Branch of the Chicago Public Library. “Demographically, the surrounding area is characterized by an educated, highly skilled, white-collar work force with an average household income of $145,443 within a half-mile radius,” he said. According to Tortorello, the property, which is currently zoned M1-2 Restricted Manufacturing District, is adjacent to residential and business zoning districts. The disposition marks the end of a 114-year-old Chicago manufacturing business.<br><br>End of an Era<br><br>The building was designed to accommodate a bank-note printing company, but during the Great Depression, the printer went bankrupt. On November 16, 1936, the building was purchased to house Rubens &amp; Marble, a company that specialized in the manufacture of quality infant’s cotton underwear since its founding in 1890. In 1912, the company was incorporated, and the name has remained the same for 92 years. In fact the same drawing of the building has appeared on the company letterhead for more than 60 years.<br><br>“The peak for our business was during the Baby Boom following World War II. At that time I am told there were 300 employees making baby clothes to meet the demand,” said Richard A. Rubens, President of Rubens &amp; Marble. During the late 1980s and early 1990s, the company averaged approximately 95 employees. Today there are 38 employees, but not for long. Rubens &amp; Marble will close for good by Thanksgiving of this year.<br><br>“We can no longer compete. The imports coming from China are cheaper than I can manufacture them for. The quality? Not bad,” he said. According to Rubens, the primary downside of imports is the limited line. “Whereas we make baby underwear in all oddball sizes and styles, the exporters only make the most popular sizes and styles,” he said.<br><br>Other factors contributing to the demise of Rubens &amp; Marble include his two sons’ decisions not to carry on the textile manufacturing business (but to become a doctor and a lawyer) and competition from volume discounters. “At one time, we sold to the big discount stores, but today we are national institutional suppliers serving hospitals across the country,” he said.<br>According to Rubens, by far the most significant factor leading to the demise of his business is the dramatic increase in the minimum wage. “The State of Illinois raised the minimum wage by $.35 per hour in January of this year. When we raised our prices to absorb the increase, we lost a ton of business. Now the minimum wage is set to increase another dollar per hour from $5.50 to $6.50 per hour on January 1st of 2005. It is the last straw. You can’t make money when your costs keep going up and your volume keeps going down,” he said.<br><br>Over the years the company has become a well-known neighbor in Lincoln Park. “We occasionally sell to the public from two desks piled high with baby clothes,” Rubens said. Along the way, it has even acquired a nickname. “Our building is located just down the street from the Oscar F. Mayer Grade School (2250 North Clifton Avenue). During the early 1970s, a little girl attending the school used to eat her lunch in the lobby of our building to avoid being taunted by the schoolboys. She referred to the building as the Rubens Baby Factory, and it stuck,” he said.<br><br>Rubens admits it is upsetting to leave a building he has been coming to since he was seven years old, but he’s not bitter. “Right now we are extremely busy serving our customers, but I am looking forward to traveling.”<br><br>If you drive by the building today, you will see a sign in the window that says “Rubens Baby Factory Store.” Come Thanksgiving, you may also see another sign: “Gone fishing.<br><br>About Newcastle Limited<br>Chicago-based Newcastle Limited is a national commercial real estate firm serving governmental agencies, institutions, not-for-profit organizations, corporations and private investors. The firm’s strategic advisory, development and investment services are designed to reduce project risk and maximize asset value. To learn more about Newcastle, call Mike Haney at (312) 252-1401 or visit the company website at www.newcastlelimited.com.",,
Press Release,Newcastle Limited to Conduct Sealed-Bid Offering for Three Loop Commercial Buildings for The Art Institute of Chicago,"June 22, 2004",,"CHICAGO - Newcastle Limited has been retained by The Art Institute of Chicago to conduct a sealed-bid offering for three Loop commercial buildings, located in Jewelers Row on the east side of Wabash Avenue between Madison and Monroe Streets, announced Michael R. Haney, President of Chicago-based real estate firm. Newcastle Limited is a national real estate advisory and development firm serving not-for-profit corporations, institutions, investors, corporations and governmental agencies.According to Haney, The Art Institute acquired the buildings in 1999 for potential use as school facilities, but has since determined that proceeds from the sale of the buildings will best be re-deployed to support its core mission. The deadline for submitting proposals is July 15, 2004. The buildings will be offered individually or as a package.The properties are located at 21-29 South Wabash Avenue within the City of Chicago's ""Jewelers Row District,"" which was designated a Chicago Landmark in July of 2003. The five- and six-story wood-framed brick structures, built between 1872 and 1881, comprise a total land area of 28,400 SF and 176,700 SF of office and retail space including one level beneath grade.""Although significant capital improvements would be required to achieve the upside potential of these buildings, they are diamonds in the rough, and they are in one of Chicago's best locations in close proximity to Millennium Park, Lake Michigan and the State Street shopping area. A purchaser may use the financial benefits of historic tax credits, the Historic District designation, the existing TIF district, and the lower real estate taxes available through Cook County's ""Class L"" incentive program to add value to these assets,"" he said.The site is zoned B6-7 allowing a base floor-area ratio of 16.0. ""The key to unlocking the value of these facilities is either the development of the 27,200 SF of street-level retail space with creative reuse of the upper floors or the redevelopment of the entire parcel combined with the additional development rights and Monroe Street access provided by the adjacent Art Institute-owned corner building into a mixed-use, high-rise project. The 'East Loop' market, which historically has been a corridor of an eclectic mix of retail and office users, is positioned for rejuvenation as a result of recent successful residential developments and the demand for retail space and other amenities,"" he said. According to Haney, the properties are being marketed to Chicago-area developers, not-for-profit organizations, retail property investors, and owners of similar and nearby properties.The Jewelers Row Historic Landmark District is bounded by Washington Street on the north, Monroe Street on the south, State Street on the west, and Garland Court on the east. Those structures in the district, designed by some of Chicago's most significant architects and built between 1872 and 1941, represent many important building types including post-Chicago Fire and Chicago School loft manufacturing, mercantile and office buildings and early 20th Century skyscrapers.Recently Newcastle Limited represented 73 owners in the $35,000,000 disposition of the historic, 1,300,000 SF, 14-acre South Water Market; represented Loyola University Chicago in the disposition of its 17-acre Mallinckrodt Campus to the Wilmette Park District; represented Baxter International in a sealed-bid disposition of a 70-acre development property in Lake County; and represented the Eleanor Women's Foundation in the disposition of its 1550 North Dearborn Parkway building to The Latin School of Chicago. The company is currently representing Loyola University Chicago in the development of a 24,800 SF high-rise site within its Water Tower Campus and Metropolitan Family Services on the sale of 116 acres on the Fox River in McHenry County.About Newcastle LimitedChicago-based Newcastle Limited is a national commercial real estate firm serving governmental agencies, institutions, not-for-profit organizations, corporations and private investors. The firm's strategic advisory, development and investment services are designed to reduce project risk and maximize asset value. To learn more about Newcastle, call Mike Haney at (312) 252-1401 or visit the company website at www.newcastlelimited.com.","CHICAGO - Newcastle Limited has been retained by The Art Institute of Chicago to conduct a sealed-bid offering for three Loop commercial buildings, located in Jewelers Row on the east side of Wabash Avenue between Madison and Monroe Streets, announced Michael R. Haney, President of Chicago-based real estate firm. Newcastle Limited is a national real estate advisory and development firm serving not-for-profit corporations, institutions, investors, corporations and governmental agencies.According to Haney, The Art Institute acquired the buildings in 1999 for potential use as school facilities, but has since determined that proceeds from the sale of the buildings will best be re-deployed to support its core mission. The deadline for submitting proposals is July 15, 2004. The buildings will be offered individually or as a package.The properties are located at 21-29 South Wabash Avenue within the City of Chicago's ""Jewelers Row District,"" which was designated a Chicago Landmark in July of 2003. The five- and six-story wood-framed brick structures, built between 1872 and 1881, comprise a total land area of 28,400 SF and 176,700 SF of office and retail space including one level beneath grade.""Although significant capital improvements would be required to achieve the upside potential of these buildings, they are diamonds in the rough, and they are in one of Chicago's best locations in close proximity to Millennium Park, Lake Michigan and the State Street shopping area. A purchaser may use the financial benefits of historic tax credits, the Historic District designation, the existing TIF district, and the lower real estate taxes available through Cook County's ""Class L"" incentive program to add value to these assets,"" he said.The site is zoned B6-7 allowing a base floor-area ratio of 16.0. ""The key to unlocking the value of these facilities is either the development of the 27,200 SF of street-level retail space with creative reuse of the upper floors or the redevelopment of the entire parcel combined with the additional development rights and Monroe Street access provided by the adjacent Art Institute-owned corner building into a mixed-use, high-rise project. The 'East Loop' market, which historically has been a corridor of an eclectic mix of retail and office users, is positioned for rejuvenation as a result of recent successful residential developments and the demand for retail space and other amenities,"" he said. According to Haney, the properties are being marketed to Chicago-area developers, not-for-profit organizations, retail property investors, and owners of similar and nearby properties.The Jewelers Row Historic Landmark District is bounded by Washington Street on the north, Monroe Street on the south, State Street on the west, and Garland Court on the east. Those structures in the district, designed by some of Chicago's most significant architects and built between 1872 and 1941, represent many important building types including post-Chicago Fire and Chicago School loft manufacturing, mercantile and office buildings and early 20th Century skyscrapers.Recently Newcastle Limited represented 73 owners in the $35,000,000 disposition of the historic, 1,300,000 SF, 14-acre South Water Market; represented Loyola University Chicago in the disposition of its 17-acre Mallinckrodt Campus to the Wilmette Park District; represented Baxter International in a sealed-bid disposition of a 70-acre development property in Lake County; and represented the Eleanor Women's Foundation in the disposition of its 1550 North Dearborn Parkway building to The Latin School of Chicago. The company is currently representing Loyola University Chicago in the development of a 24,800 SF high-rise site within its Water Tower Campus and Metropolitan Family Services on the sale of 116 acres on the Fox River in McHenry County.About Newcastle LimitedChicago-based Newcastle Limited is a national commercial real estate firm serving governmental agencies, institutions, not-for-profit organizations, corporations and private investors. The firm's strategic advisory, development and investment services are designed to reduce project risk and maximize asset value. To learn more about Newcastle, call Mike Haney at (312) 252-1401 or visit the company website at www.newcastlelimited.com.",,
