category,title,published,author and source,content,excerpt,read more text,read more link
Article,"With $41M in financing secured, Newcastle Limited breaks ground on Gold Coast development","November 23, 2020",By RE Journals,"Newcastle Limited secured $41.3 million in construction financing to support development of the firm's mixed-use project at 1210 N. State Parkway in Chicago's Gold Coast neighborhood. CIBC Bank USA is the loan administrative agent, and First Midwest Bank is a co-lender. Construction will commence this month, and delivery is slated for early 2022. ","Newcastle Limited secured $41.3 million in construction financing to support development of the firm's mixed-use project at 1210 N. State Parkway in Chicago's Gold Coast neighborhood. CIBC Bank USA is the loan administrative agent, and First Midwest Bank is a co-lender. Construction will commence this month, and delivery is slated for early 2022. ",Read the full article here.,https://rejournals.com/with-41m-in-financing-secured-newcastle-limited-breaks-ground-on-gold-coast-development/
Article,"Scaled-down, 29-story apartment tower proposed for Barnes &amp; Noble site on Near North Side","October 14, 2020","By Ryan Ori, Chicago Tribune",Chicago Tribune reports on Newcastle Limited's proposed plans for the site at 1120 to 1130 N. State Street.,Chicago Tribune reports on Newcastle Limited's proposed plans for the site at 1120 to 1130 N. State Street.,Read the full article here.,https://www.chicagotribune.com/columns/ryan-ori/ct-biz-barnes-and-noble-redevelopment-proposal-ryan-ori-20201014-rbn76jheinhuphxsv36mvjrwse-story.html
Article,Developer shrinks Gold Coast high-rise proposal,"October 13, 2020","By Alby Gallun, Crain's Chicago Chicago Business",Crain's Chicago Business reports on Newcastle's revised development plans to be presented on October 22nd at a virtual community meeting.,Crain's Chicago Business reports on Newcastle's revised development plans to be presented on October 22nd at a virtual community meeting.,Read the full article here.,https://www.chicagobusiness.com/commercial-real-estate/developer-shrinks-gold-coast-high-rise-proposal?_ptid=%7Bjcx%7DH4sIAAAAAAAAAI2QUW-CMBSF_0ufxbS0QMubMepAhptxTH2rpUA3rAhFTZb994GbW5bsYUnTpPc7597b8wa4SoEP3KCM9XwzIy0YgIrnMlHyHPTEhja0UHfc_obQwthyKbWeoipYFm2gC-nZehxYmLo7gRjBmHGSCpFlO-GkkGQcOo6dsq6xvFSyVlILeW09WbubKGShFyynv-jkIkVr1EFfZYhCekQQ2f14CG3DClPCY5WZlwyRJkeZ09Jf_pH4NjfF4byS-6rkRkbb1cPSofebxTxGqHMUvLkx4Ju6lQNgvt5X82KVYHTHAu8xXoIflvBacW1uku2Ihs4sXof9JwTfV1zlugG-bstyAE6qUZ_Sk_VnloxYr9Ei3Gbm2SnHCW2C6X-yVFUfDfSGNqJDSoYEdsW2kfUol9p0LD2LfmdTAh-50GbEpRi_fwDNJm-x8QEAAA&CSAuthResp=1%3A%3A290168%3A359%3A24%3Asuccess%3A91659AE14D13C75DE7CDCD589A79BBB3
Article,Steve Merchant joins Newcastle Limited as Managing Director,"July 28, 2020",By RE Journals,"Newcastle Limited expanded its senior leadership team with the addition of Steve Merchant as managing director of multifamily operations. Merchant will oversee the operation of Newcastle's 3,000-unit multifamily portfolio and the team of 100 employees responsible for management and leasing.","Newcastle Limited expanded its senior leadership team with the addition of Steve Merchant as managing director of multifamily operations. Merchant will oversee the operation of Newcastle's 3,000-unit multifamily portfolio and the team of 100 employees responsible for management and leasing.",Read the full article here.,https://rejournals.com/steve-merchant-joins-newcastle-limited-as-managing-director-of-multifamily-operations/
Article,MJ Zaring joins Newcastle Limited as Vice President of Asset Management,"April 14, 2020",By RE Journals,"MJ Zaring has joined Chicago-based Newcastle Limited as vice president of asset management. In her new position, Zaring will be part of Newcastle's portfolio management team, where she will focus on strategic planning for the firm's assets.","MJ Zaring has joined Chicago-based Newcastle Limited as vice president of asset management. In her new position, Zaring will be part of Newcastle's portfolio management team, where she will focus on strategic planning for the firm's assets.",Read the full article here.,https://rejournals.com/mj-zaring-joins-newcastle-limited-as-vice-president-of-asset-management/
Article,"Laura Giampietro joins Newcastle Limited as SVP, marketing","January 15, 2020",By RE Journals,"Newcastle Limited announced the expansion of its team with the addition of Laura Giampietro as senior vice president of marketing. In her new position, Giampietro will be responsible for leading the Chicago-based firm’s marketing and communications initiatives. ","Newcastle Limited announced the expansion of its team with the addition of Laura Giampietro as senior vice president of marketing. In her new position, Giampietro will be responsible for leading the Chicago-based firm’s marketing and communications initiatives. ",Read the full article here.,"https://www.rejournals.com/laura-giampietro-joins-newcastle-limited-as-svp,-marketing-20200115.aspx"
Article,New Design for Gold Coast Apartments Guided by Fresh Approach from City Planners,"November 4, 2019","By Jay Koziarz, Curbed Chicago",Curbed Chicago details the latest updates to Newcastle's development plans for 1212 N. State in the Gold Coast.,Curbed Chicago details the latest updates to Newcastle's development plans for 1212 N. State in the Gold Coast.,Read the full article here.,https://chicago.curbed.com/2019/11/4/20944295/gold-coast-apartment-development-state-division-design-change
Article,Newcastle Buys West Loop Apartments,"October 31, 2019","By Minho Kim, Crain's Chicago Business",Read about Newcastle's latest acquisition of 1241-1245 W Jackson Blvd. in the West Loop in Crain's Chicago Business.,Read about Newcastle's latest acquisition of 1241-1245 W Jackson Blvd. in the West Loop in Crain's Chicago Business.,Click here.,https://www.chicagobusiness.com/residential-real-estate/newcastle-buys-west-loop-apartments
Article,People on the Move,"May 2, 2019",By Crain's Chicago Business,"Dan Thalheimer has joined Newcastle Limited as Vice President of  Acquisitions. In his new role, Dan will focus on sourcing multifamily  and retail acquisition opportunities as Newcastle continues to grow its  Chicago investment portfolio.","Dan Thalheimer has joined Newcastle Limited as Vice President of  Acquisitions. In his new role, Dan will focus on sourcing multifamily  and retail acquisition opportunities as Newcastle continues to grow its  Chicago investment portfolio.",Read the full article here.,https://www.chicagobusiness.com/people-on-the-move/dan-thalheimer
Article,Dan Thalheimer joins Newcastle Limited as VP of acquisitions,"April 23, 2019",By RE Journals,"Newcastle Limited expanded its team with the addition of Dan Thalheimer as vice president  of acquisitions. In his new position, Thalheimer will be responsible for sourcing new opportunities and helping to grow Newcastle’s retail and  multifamily investment portfolio.","Newcastle Limited expanded its team with the addition of Dan Thalheimer as vice president  of acquisitions. In his new position, Thalheimer will be responsible for sourcing new opportunities and helping to grow Newcastle’s retail and  multifamily investment portfolio.",Read the full article here.,https://www.newcastlelimited.com/
Article,DineAmic Group Opening Fulton Market Restaurant,"March 29, 2019","By Ari Bendersky, Crain's Chicago Business","The team behind Siena Tavern, Bar Siena and Prime &amp; Provisions is opening a ""refined dive bar"" in the Randolph Street spot that was once Graham Elliot's Gideon Sweet located in Newcastle's Gin Alley.","The team behind Siena Tavern, Bar Siena and Prime &amp; Provisions is opening a ""refined dive bar"" in the Randolph Street spot that was once Graham Elliot's Gideon Sweet located in Newcastle's Gin Alley.",Read the full article here.,https://www.chicagobusiness.com/restaurants/dineamic-group-opening-fulton-market-restaurant
Article,Rumble Selects Gold Coast Neighborhood for its First Chicago Location,"March 5, 2019","By Kristen Hiller, REBusiness Online","Rumble, a boxing-inspired workout concept, has selected its first Chicago location at 1139 N. State St. in the Gold Coast neighborhood. ","Rumble, a boxing-inspired workout concept, has selected its first Chicago location at 1139 N. State St. in the Gold Coast neighborhood. ",Read the full article here.,http://rebusinessonline.com/rumble-selects-gold-coast-neighborhood-for-its-first-chicago-location/
Article,Newcastle Pays $86M for Chicago Property,"March 1, 2019","By Jeffrey Steele, Multi-Housing News",Newcastle Limited has acquired a two-building apartment community in Chicago’s fast-emerging River West neighborhood.,Newcastle Limited has acquired a two-building apartment community in Chicago’s fast-emerging River West neighborhood.,Read the full article here.,https://www.multihousingnews.com/post/newcastle-pays-86m-for-chicago-property/?utm_source=whatcountsemail&utm_medium=daily%20news&utm_campaign=daily
Article,Brendan Sodikoff Opening Supper Club in Fulton Market,"February 4, 2019","By Ari Bendersky, Crain's Chicago Business","Hogsalt Hospitality owner, Brendan Sodikoff, speaks with Crain's about his plan for a Midwest-inspired supper club at Newcastle's Gin Alley. The as-yet-unnamed restaurant will join Green Street Smoked Meats and RM Champagne Salon in the cobblestone alley. The restaurant is scheduled to open midsummer 2019.","Hogsalt Hospitality owner, Brendan Sodikoff, speaks with Crain's about his plan for a Midwest-inspired supper club at Newcastle's Gin Alley. The as-yet-unnamed restaurant will join Green Street Smoked Meats and RM Champagne Salon in the cobblestone alley. The restaurant is scheduled to open midsummer 2019.",Read the full article here.,https://www.chicagobusiness.com/restaurants/brendan-sodikoff-opening-supper-club-fulton-market
Article,Newcastle Acquires Chicago Multifamily Asset,"December 18, 2018","By Roxana Baiceanu, Multi-Housing News",MHN covers Newcastle's latest mixed-use acquisition in Chicago's Logan Square neighborhood.,MHN covers Newcastle's latest mixed-use acquisition in Chicago's Logan Square neighborhood.,Read the full article here.,https://www.multihousingnews.com/post/newcastle-acquires-chicago-multifamily-asset/
Article,New retail ready to rise at State and Elm in the Gold Coast,"October 25, 2018","By Jay Koziarz, Curbed Chicago",Curbed Chicago announces Newcastle's permit approval for the new retail development at 1139 N. State St. in Chicago's Gold Coast neighborhood.,Curbed Chicago announces Newcastle's permit approval for the new retail development at 1139 N. State St. in Chicago's Gold Coast neighborhood.,Read the full article here.,https://chicago.curbed.com/2018/10/25/18000000/construction-gold-coast-retail-state-and-elm
Article,Andersonville Now Has a New Coffee Shop From an Acclaimed Milwaukee Roaster,"September 24, 2018","By Ashok Selvam, Chicago Eater","Chicago Eater announces the opening of Colectivo Coffee at Newcastle's asset, 5425 N. Clark St. in Andersonville.","Chicago Eater announces the opening of Colectivo Coffee at Newcastle's asset, 5425 N. Clark St. in Andersonville.",Read the full article here.,https://chicago.eater.com/2018/9/24/17896534/colectivo-coffee-andersonville-cafe-open
Article,Newcastle Limited buys Near North Side commercial building for $10M,"August 15, 2018","By John O'Brien, The Real Deal Chicago Real Estate News",The Real Deal covers the announcement of Newcastle's latest commercial acquisition at State and Division.,The Real Deal covers the announcement of Newcastle's latest commercial acquisition at State and Division.,Read the full article here.,https://therealdeal.com/chicago/2018/08/14/newcastle-limited-buys-near-north-side-commercial-building-for-10m/
Article,Newcastle Nabs Retail Space at Two West Delaware Tower,"June 13, 2018","By Laura Hanrahan, The Real Deal Chicago Real Estate News","The Real Deal announces Newcastle's latest acquisitions including retail space at 2 W Delaware, a two-story retail property at 2368 N Clark and a 73-unit apartment building at 24 S Morgan.","The Real Deal announces Newcastle's latest acquisitions including retail space at 2 W Delaware, a two-story retail property at 2368 N Clark and a 73-unit apartment building at 24 S Morgan.",Read the full article here.,https://therealdeal.com/chicago/2018/06/13/newcastle-nabs-retail-space-at-two-west-delaware-tower/
Article,Greg Lozinak Joins Newcastle Limited as COO,"April 19, 2018",By Crain's Chicago Business,Crain's Chicago Business announces Greg Lozinak as Newcastle Limited's new COO.,Crain's Chicago Business announces Greg Lozinak as Newcastle Limited's new COO.,Read the full article here.,http://www.chicagobusiness.com/section/people-on-the-move/3502824
Article,West Loop apartment building sells for less than 2016 price,"November 21, 2017","By Danny Ecker, Crain's Chicago Business",Crain's Chicago Business reports on Newcastle's purchase of a high-rise in the West Loop.,Crain's Chicago Business reports on Newcastle's purchase of a high-rise in the West Loop.,Read the full article here.,http://www.chicagobusiness.com/realestate/20171121/CRED03/171129973/west-loop-apartment-building-sells-to-newcastle-for-less-than-it-did
Article,Amsterdam firm Spaces joins Chicago's growing co-working scene,"August 11, 2017","By Ryan Ori, Chicago Tribune",The Chicago Tribune featured Newcastle's lease to Spaces in its loft office building located in the Clybourn corridor.,The Chicago Tribune featured Newcastle's lease to Spaces in its loft office building located in the Clybourn corridor.,Read the full article here.,http://www.chicagotribune.com/business/columnists/ct-spaces-coworking-ryan-ori-0811-biz-20170810-column.html
Article,Yappy Hours' are now a thing. Rental buildings are ramping up pet perks,"July 12, 2017","By Alison Bowen, Chicago Tribune","The Chicago Tribune featured Newcastle's luxury building, State &amp; Chestnut, for a piece on the best pet amenities in the city.","The Chicago Tribune featured Newcastle's luxury building, State &amp; Chestnut, for a piece on the best pet amenities in the city.",Read the full article here.,http://www.chicagotribune.com/classified/realestate/ct-re-0716-pet-amenities-20170712-story.html
Article,Newcastle buys apartments on Fullerton in Lincoln Park,"April 17, 2017",By Crain's Chicago Business,Crain's Chicago Business reports on Newcastle's purchase of a 48-unit apartment building in Lincoln Park.,Crain's Chicago Business reports on Newcastle's purchase of a 48-unit apartment building in Lincoln Park.,Read the full article here.,http://www.chicagobusiness.com/realestate/20170417/CRED03/170419887/family-sells-lincoln-park-apartments-after-100-years
Article,Fulton Market block poised to sell for $68 million,"November 23, 2016",By Crain's Chicago Business,Crain's Chicago Business reports on Newcastle's $68 million deal to buy a full block of Fulton Market District buildings.,Crain's Chicago Business reports on Newcastle's $68 million deal to buy a full block of Fulton Market District buildings.,Read the full article here.,http://www.chicagobusiness.com/realestate/20161123/CRED03/161129949/fulton-market-block-owned-by-gin-estate-poised-to-sell-to-newcastle
Article,People on the Move,"November 14, 2016",By Crain's Chicago Business,Crain's Chicago Business reports on Newcastle Limited's new Chief Financial Officer.,Crain's Chicago Business reports on Newcastle Limited's new Chief Financial Officer.,Read the full article here.,http://www.chicagobusiness.com/section/people-on-the-move/3431829
Article,Another upscale steakhouse is coming to River North,"June 17, 2016",By Crain's Chicago Business,Craiin's Chicago Business reports on Steak 48 moving into River North at 615 N. Wabash Ave.,Craiin's Chicago Business reports on Steak 48 moving into River North at 615 N. Wabash Ave.,Read the full article here.,http://www.chicagobusiness.com/article/20160617/BLOGS09/160619858/can-river-north-support-another-steakhouse-these-folks-hope-so
Article,Developer Forgoes High-Rise for Lucrative Low-Rise Retail in River North,"June 1, 2016","By Jay Koziarz, Curbed Chicago",Curbed Chicago reports on Newcastle Limited's deal with Steak 48 in River North.,Curbed Chicago reports on Newcastle Limited's deal with Steak 48 in River North.,Read the full article here.,http://chicago.curbed.com/2016/6/1/11826200/chicago-river-north-development-news-retail-wabash
Article,Apartment Hunt: State &amp; Chestnut at the middle of everything,"April 20, 2016","By Pamela Dittmer McKuen, Chicago Tribune","The Chicago Tribune reports on State &amp; Chestnut, Newcastle Limited's 367 unit apartment building in the Gold Coast.","The Chicago Tribune reports on State &amp; Chestnut, Newcastle Limited's 367 unit apartment building in the Gold Coast.",Read the full article here.,http://www.chicagotribune.com/classified/realestate/ct-apartment-hunt-state-chestnut-story.html
Article,"Newcastle lands loan, tenant for Lakeview project","October 7, 2014",By ChicagoRealEstateDaily.com Powered by Crain's Chicago Business,"Crain's Chicago Business reports on Newcastle's retail development at 3301 N. Ashland Avenue in Lakeview, which has signed its first tenant, the Vitamin Shoppe.","Crain's Chicago Business reports on Newcastle's retail development at 3301 N. Ashland Avenue in Lakeview, which has signed its first tenant, the Vitamin Shoppe.",Read the full article here.,http://www.chicagobusiness.com/realestate/20141007/CRED03/141009851/rooftop-farm-coming-to-new-pullman-factory
Article,Newcastle pays $8 million for Clybourn Corridor building,"September 18, 2014","By Micah Maidenberg, ChicagoRealEstateDaily.com Powered by Crain's Chicago Business","Micah Maidenberg reports on Newcastle Limited's purchase of a four-story, 45,000 s.f. building at 1500 N. Halsted in the Clybourn Corridor retail district for $8 million.","Micah Maidenberg reports on Newcastle Limited's purchase of a four-story, 45,000 s.f. building at 1500 N. Halsted in the Clybourn Corridor retail district for $8 million.",Read the full article here.,http://www.chicagobusiness.com/realestate/20140918/CRED03/140919817/newcastle-pays-8-million-for-clybourn-corridor-building
Article,"Newcastle buying in River North, Clybourn Corridor","April 9, 2014","By Micah Maidenberg, ChicagoRealEstateDaily.com Powered by Crain's Chicago Business","Micah Maidenberg from Crain's Chicago reports on Newcastle's acquisition of a 8,900-square-foot parcel with an existing 15,469-square-foot commerical.","Micah Maidenberg from Crain's Chicago reports on Newcastle's acquisition of a 8,900-square-foot parcel with an existing 15,469-square-foot commerical.",Read the full article here.,http://www.chicagorealestatedaily.com/realestate/20140409/CRED03/140409723/newcastle-buying-in-river-north-clybourn-corridor
Article,Newcastle pays $19 million for Gold Coast retail and office space,"March 20, 2014","By Micah Maidenberg, ChicagoRealEstateDaily.com Powered by Crain's Chicago Business","Crain's Real Estate Daily covers Newcastle's acquisition of a 21,000-square-foot, two-story retail and office condominum space at the base of the Bristol in Chicago's Gold Coast neighborhood.","Crain's Real Estate Daily covers Newcastle's acquisition of a 21,000-square-foot, two-story retail and office condominum space at the base of the Bristol in Chicago's Gold Coast neighborhood.",Read the full article here.,http://www.chicagobusiness.com/realestate/20140320/CRED03/140319695/newcastle-pays-19-million-for-gold-coast-retail-and-office-space
Article,Newcastle pays $12.3 million for Old Town apartments,"January 23, 2014",By ChicagoRealEstateDaily.com Powered by Crain's Chicago Business,Crain's Chicago Real Estate Daily reports on Newcastle's purchase of a 56-unit apartment building at 1700 N. North Park Avenue in Old Town.,Crain's Chicago Real Estate Daily reports on Newcastle's purchase of a 56-unit apartment building at 1700 N. North Park Avenue in Old Town.,Read the full article here.,http://www.chicagorealestatedaily.com/realestate/20140123/CRED03/140129860/newcastle-pays-12-3-million-for-old-town-apartments
Article,Newcastle able to triple debt on 2 apartment buildings,"October 14, 2013","By Micah Maidenberg, ChicagoRealEstateDaily.com Powered by Crain's Chicago Business","Crain's covers Newcastle's refinancing of two of its multifamily properties, 707 W. Sheridan in Lakeview and 532 W. Roscoe in Lincoln Park.  The new $26.9 milliion loan replaces the existing loan balance of $7.9 million.  ","Crain's covers Newcastle's refinancing of two of its multifamily properties, 707 W. Sheridan in Lakeview and 532 W. Roscoe in Lincoln Park.  The new $26.9 milliion loan replaces the existing loan balance of $7.9 million.  ",,
Article,Newcastle Limited closes on $79.5 million loan for Gold Coast apartment development,"September 26, 2013","By Kirk Meyer, Chicago Development News",Chicago Development News reports on Newcastle Limited's securing a $79.5 million construcion loan for the firm's Gold Coast apartment development at 845 N. State Street.  ,Chicago Development News reports on Newcastle Limited's securing a $79.5 million construcion loan for the firm's Gold Coast apartment development at 845 N. State Street.  ,,
Article,JPMorgan bankrolls Newcastle's Gold Coast apartment tower,"September 20, 2013","By Micah Maidenberg, ChicagoRealEstateDaily.com Powered by Crain's Chicago Business","Micah Maidenberg of Crain's Chicago Business reports on Newcastle's $79.5 million construction loan for the firm's 35-story, 367-unit apartment tower in Chicago's Gold Coast neighborhood.  JPMorgan Chase is the administrative agent, Fifth Third Bank is the syndication agent, and the Private Bank is a loan participant.  ","Micah Maidenberg of Crain's Chicago Business reports on Newcastle's $79.5 million construction loan for the firm's 35-story, 367-unit apartment tower in Chicago's Gold Coast neighborhood.  JPMorgan Chase is the administrative agent, Fifth Third Bank is the syndication agent, and the Private Bank is a loan participant.  ",,
Article,The Deal Sheet: Newcastle acquired property at State and Chestnut,"September 16, 2013","By Marissa Oberlander, Chicago Real Estate Bisnow",Chicago Bisnow reports on Newcastle Limited's acquisition of property at State and Chestnut for its new development project.  ,Chicago Bisnow reports on Newcastle Limited's acquisition of property at State and Chestnut for its new development project.  ,,
Article,Newcastle acquires Gold Coast parcel,"September 9, 2013",By ChicagoRealEstateDaily.com Powered by Crain's Chicago Business,"Crain's Chicago reports on Newcastle's land acquisition at the corner of State and Chestnut streets for a new 35-story, 367-unit apartment tower in the Gold Coast neighborhood.","Crain's Chicago reports on Newcastle's land acquisition at the corner of State and Chestnut streets for a new 35-story, 367-unit apartment tower in the Gold Coast neighborhood.",Read the full article here.,http://www.chicagorealestatedaily.com/article/20130909/CRED03/130909845/ex-bookkeeper-for-fred-lev-gets-12-years
Article,Newcastle pays $16.2 million for Wicker Park retail portfolio,"August 28, 2013","By Micah Maidenberg, ChicagoRealEstateDaily.com Powered by Crain's Chicago Business","Micah Madienberg reports on Newcastle's latest acquisition of five retail properties in Chicago's Wicker Park neighborhood.  The 28,000-square-foot portfolio is made up of a freestanding, two-story building at 1455 N. Miwaukee Avenue and four retail condominiums at 1519 - 1529 N. Milwaukee Avenue, adding to the firm's existing Wicker Park/Bucktown portfolio.","Micah Madienberg reports on Newcastle's latest acquisition of five retail properties in Chicago's Wicker Park neighborhood.  The 28,000-square-foot portfolio is made up of a freestanding, two-story building at 1455 N. Miwaukee Avenue and four retail condominiums at 1519 - 1529 N. Milwaukee Avenue, adding to the firm's existing Wicker Park/Bucktown portfolio.",,
Article,The Deal Sheet: Kristen Martin joined Newcastle,"July 31, 2013","By Marissa Oberlander, Chicago Real Estate Bisnow",Chicago Real Estate Bisnow reports on the addition of Kristen Martin to Newcastle Limited as director of retail leasing.,Chicago Real Estate Bisnow reports on the addition of Kristen Martin to Newcastle Limited as director of retail leasing.,,
Article,Plan Commission signs off on Gold Coast rental tower,"March 25, 2013",By ChicagoRealEstateDaily.com Powered by Crain's Chicago Business,Crain's covers the Chicago Paln Commssion's approval of Newcastle's plans to develop a 36-story apartment tower at the corner of State and Chestnut Streets in the Gold Coast neighborhood.  ,Crain's covers the Chicago Paln Commssion's approval of Newcastle's plans to develop a 36-story apartment tower at the corner of State and Chestnut Streets in the Gold Coast neighborhood.  ,,
Article,Newcastle plans 35-story apartment tower in Gold Coast,"December 11, 2012","By Micah Maidenberg, ChicagoRealEstateDaily.com Powered by Crain's Chicago Business","Micah Maidenberg from Crain's Real Estate Daily interviwed Peter Tortorello, Senior Vice President at Newcastle Limited, about the firm's planned 35-story, 367-unit apartment tower in Chicago's Gold Coast neighborhood.","Micah Maidenberg from Crain's Real Estate Daily interviwed Peter Tortorello, Senior Vice President at Newcastle Limited, about the firm's planned 35-story, 367-unit apartment tower in Chicago's Gold Coast neighborhood.",,
